{
  "schemaVersion": 1,
  "sequence": 0,
  "channel": "stable",
  "version": "0.1.5",
  "publishedAt": "2026-07-20T12:00:00Z",
  "expiresAt": "2026-10-18T12:00:00Z",
  "minimumUpdaterVersion": "0.1.5",
  "minimumLauncherVersion": "1.0.0",
  "available": false,
  "withdrawnReason": "Bootstrap updater v0.1.5 has not been published.",
  "revokedVersions": [],
  "releaseNotesUrl": "https://github.com/MrPastio/monarch-releases",
  "compatibility": {
    "runtimeVersion": "bootstrap-pending",
    "backendEnvironment": "bootstrap-pending",
    "dataSchemaVersion": 1,
    "minimumReadableDataSchema": 1,
    "maximumReadableDataSchema": 1,
    "minimumModelCatalogSchema": 1,
    "maximumModelCatalogSchema": 1
  },
  "asset": null,
  "keyId": "monarch-release-2026-01"
}

